{
  "api": "RedFrameworks Static API",
  "current": "v4",
  "supported": [
    "v1",
    "v2",
    "v3",
    "v4"
  ],
  "updated": "2026-09-30",
  "counts": {
    "entries": 196,
    "frameworks": 62,
    "tools": 134,
    "books": 10,
    "certifications": 13,
    "learning_paths": 7,
    "adversaries": 42,
    "intelligence_sources": 13,
    "emulation_plans": 13,
    "not_verified": 79,
    "relationships": 89,
    "techniques": 2,
    "campaigns": 8,
    "detections": 12,
    "domain_packs": 8,
    "ai_security_surfaces": 9
  },
  "endpoints": {
    "catalog": "catalog.json",
    "relationships": "relationships.json",
    "frameworks": "frameworks.json",
    "resources": "resources.json",
    "learning_paths": "learning-paths.json",
    "adversaries": "adversaries.json",
    "intelligence_sources": "intelligence-sources.json",
    "emulation_plans": "emulation-plans.json",
    "verification_queue": "verification-queue.json",
    "techniques": "techniques.json",
    "standards": "standards.json",
    "successors": "successors.json",
    "campaigns": "campaigns.json",
    "detections": "detections.json",
    "domain_packs": "domain-packs.json",
    "ai_security_surface": "ai-security-surface.json",
    "knowledge_graph": "knowledge-graph.json",
    "verification_v2": "verification-v2.json",
    "visual_intelligence": "visual-intelligence.json",
    "research_corpus": "research-corpus.jsonl"
  }
}
